Hotel_Name,Positive_Review
Commodore Hotel, Clean good bathroom and lication
Commodore Hotel, Location Price Cleanliness
Commodore Hotel, Very dated hotel threadbare carpets holes in the wall
Commodore Hotel, Friendly personnel great attitude thank you for your hospitality we will come back 
Commodore Hotel, Amazingly friendly staff very helpful Nice room with balcony good English breakfast 
Commodore Hotel, Posizione
Commodore Hotel, Cozy environment location makes this place 
Commodore Hotel, Good location Old building 
Commodore Hotel,No Positive
Commodore Hotel, Comfy bed 
Commodore Hotel, good location room staff
Commodore Hotel, Nothing
Commodore Hotel, Having a balcony
Commodore Hotel, Location
Commodore Hotel, everything was fine except for the shower
Commodore Hotel, Nothing
Commodore Hotel, Nice big bedrooms
Commodore Hotel, Location was convenient for the business day
Commodore Hotel, Balcony and location
Commodore Hotel,No Positive
Commodore Hotel, Location and price 
Commodore Hotel, Great location service was good Breakfast with reasonable price
Commodore Hotel, location
Commodore Hotel, Staff were really helpful and very cheerful 
Commodore Hotel, Comfortable
Commodore Hotel, Great location close to buses and underground across the road from Hyde park 
Commodore Hotel, Great location walking distance to Winter Wonderland Clean and nice
Commodore Hotel, Very spacious rooms and excellent location 
Commodore Hotel, The room was comfortable
Commodore Hotel, Near Hyde park 
Commodore Hotel, Really good pace lots of room for friends really clean and great bathrooms
Commodore Hotel, Comfy room and great location close to Bayswater tube 
Commodore Hotel, Great location impressive entrance comfy bed and huge walk in shower and limitless hot water 
Commodore Hotel, Staff very friendly and helpful Location perfect for us didn t use any of the facilities but all looked good 
Commodore Hotel, The location is good
Commodore Hotel, Staff were extremely friendly
Commodore Hotel, The location
Commodore Hotel, Staff was really helpful and friendly loved the hotel and it s service and how they keep their customers satisfied 
Commodore Hotel, location was great the view to Hyde park
Commodore Hotel,No Positive
Commodore Hotel,No Positive
Commodore Hotel, Location was great Close to the centre of London 
Commodore Hotel, The room etc was clean breakfast was OK but not included
Commodore Hotel, The place is really nice and the location perfect 
Commodore Hotel, Excellent location Friendly staff
Commodore Hotel, Good place close to the tube and buses
Commodore Hotel,No Positive
Commodore Hotel,No Positive
Commodore Hotel,No Positive
Commodore Hotel, Good large bed
Commodore Hotel, Location Cleanness Malesna in the reception is so helpful 
Commodore Hotel, Breakfast
Commodore Hotel,No Positive
Commodore Hotel, Enormous bed
Commodore Hotel, Staff very friendly
Commodore Hotel, Staff very friendly
Commodore Hotel,No Positive
Commodore Hotel, Fantastic location
Commodore Hotel, Staying with my son nice friendly clean hotel
Commodore Hotel, Good location staff friendly and professional Rooms clean and well stocked
Commodore Hotel, The Apartment very clean and the location is great
Commodore Hotel, Great service and a comfortable room
Commodore Hotel, Good location Easy access to the parks and London is very walkable
Commodore Hotel, Proximity ie walking distance to lots of things
Commodore Hotel, Decently priced well located
Commodore Hotel, Brilliant location Great value for money
Commodore Hotel, nothing much
Commodore Hotel, British flair
Commodore Hotel, Great stAy receptionist was a charming girl Gave us an apartment for our stay was great
Commodore Hotel, Good staff 
Commodore Hotel,No Positive
Commodore Hotel, Beds clean
Commodore Hotel, Excallent location
Commodore Hotel,No Positive
Commodore Hotel,No Positive
Commodore Hotel, good price
Commodore Hotel, Location was really good Very close to Lancaster gate station The size of the room was very good The quality of the food was also very high 
Commodore Hotel, Great location clean and comfortable Good price 
Commodore Hotel,No Positive
Commodore Hotel, The Staff were amazing and the room was super comfortable 
Commodore Hotel, good breakfast and value for money
Commodore Hotel,No Positive
Commodore Hotel, Nothing
Commodore Hotel, comfortable large bed aircon rooms
Commodore Hotel, Location
Commodore Hotel, Location and atmospheric hotel 
Commodore Hotel, The room smelt absolutely disgusting dusty and wasn t cleaned properly at all 
Commodore Hotel, Good location Good breakfast
Commodore Hotel, Great location quiet neighbourhood and close to Hyde Park staff were very helpful and friendly
Commodore Hotel, Great four poster bed and a excellent location
Commodore Hotel, Poor dirty
Commodore Hotel,No Positive
Commodore Hotel,No Positive
Commodore Hotel,No Positive
Commodore Hotel, Lobby area
Commodore Hotel, Very comfortable room although my 13 year old son found the sofa bed too small 
Commodore Hotel,No Positive
Commodore Hotel, Reception staff friendly and nice shower
Commodore Hotel, The location was good and the room was comfortable
Commodore Hotel,No Positive
Commodore Hotel, Location
Commodore Hotel, Location
Commodore Hotel, Location
Commodore Hotel,No Positive
Commodore Hotel, Staff were very crie dly and helpful Wifi was quite weak Room was quiet 
Commodore Hotel, Great value and such a nice room building and staff as well as a fantastic location perfect hotel
Commodore Hotel,No Positive
Commodore Hotel, The bed was lovely big and comfortable Shower was great good pressure and water hot 
Commodore Hotel, Helpful staff
Commodore Hotel, Comfortable Bed and clean toilet
Commodore Hotel, Very helpful and went out there way to get things for the room
Commodore Hotel, Location staff
Commodore Hotel, Great location
Commodore Hotel, Nicest staff so helpful 
Commodore Hotel, The hotel was located well for all amenities
Commodore Hotel, Very polite staff excellent location 
Commodore Hotel, Location
Commodore Hotel, Very beautiful scenery and extremely polite staff
Commodore Hotel, It was by the park and close to the station
Commodore Hotel, Classic style
Commodore Hotel, Please remove this hotel from your website it s terrible
Commodore Hotel, Lovely features Great location Friendly staff
Commodore Hotel, Quite neighborhood Kind Staff
Commodore Hotel, Leaving
Commodore Hotel, Good location right next to Hyde Park
Commodore Hotel, was very happy with the room upgrade
Commodore Hotel, Now
Commodore Hotel, Extremely friendly staff 
Commodore Hotel, Not much
Commodore Hotel, Compact and clean 
Commodore Hotel, The cost 
Commodore Hotel,No Positive
Commodore Hotel, Location All staff except one lady at reception was very nice
Commodore Hotel, Spacious comfortable room staff very friendly and helpful 
Commodore Hotel, Good location 
Commodore Hotel, Great Value for Location and Facilities
Commodore Hotel, Location
Commodore Hotel, Very good location Price I got was very good 
Commodore Hotel, Location for central London was excellent 
Commodore Hotel, toilet is a plus
Commodore Hotel,No Positive
Commodore Hotel, Great location friendly staff 
Commodore Hotel, Everythinnnnnng
Commodore Hotel, Location to Hyde park Comfy bed 
Commodore Hotel, Staff where Great Friendly and helped when ever could 
Commodore Hotel, The location is great
Commodore Hotel, Nice location quiete but very central Clean
Commodore Hotel, Nicely vintage decorated
Commodore Hotel, Location price staff
Commodore Hotel, I like the hotel which is in a great location and has a nice old fashioned welcome
Commodore Hotel, Very friendly and helpful staff
Commodore Hotel, Location
Commodore Hotel,No Positive
Commodore Hotel, The location
Commodore Hotel, Didn t think this was a 4 star hotel Carpet in the room was worn appeared tired wanted to charge for breakfast when it was pre booked
Commodore Hotel,No Positive
Commodore Hotel, The location
Commodore Hotel, Location of hotel
Commodore Hotel, Location superb clean and room a good size for London We even had a balcony 
Commodore Hotel,No Positive
Commodore Hotel, Great value 
Commodore Hotel, Awful experience start to finish Dreadful service 
Commodore Hotel, Great location 
Commodore Hotel, Great location Very helpful staff
Commodore Hotel, It is a classy hotel the bed was very comfortable and lovely shower
Commodore Hotel, Very old building Size of the room is Very small
Commodore Hotel, location 3 minutes from subway 1 minute from bus station
Commodore Hotel,No Positive
Commodore Hotel, Staff was so friendly and welcoming
Commodore Hotel, Very little
Commodore Hotel, Location is good close to Oxford Street
Commodore Hotel, Large clean room 
Commodore Hotel, Warm professional staff who ensured I had a pleasant stay The hotel is well appointed and in a quiet square 
Commodore Hotel,No Positive
Commodore Hotel, The Internet and the lift were down but they upgraded me for free
Commodore Hotel, Great
Commodore Hotel, It was in a great location
Commodore Hotel, nothing
Commodore Hotel, Good location
Commodore Hotel, Big rooms like for LONDON Great localization 
Commodore Hotel, great breakfast
Commodore Hotel, Nice room with veranda
Commodore Hotel, Good location central to everything Aircon and friendly staff 
Commodore Hotel, In a good area staff great 
Commodore Hotel, Location and good value for money
Ibis Styles Milano Palmanova, Pretty much nothing
Ibis Styles Milano Palmanova, The room and bathroom were clean towels changed daily metro station very close to the hotel 
Ibis Styles Milano Palmanova, Majority of staf were very friendly and helpful 
Ibis Styles Milano Palmanova, The location is good the metro station is less than 1 mins walk If your are going to the Milano central like us to transfer to another city it s straight line in the metro station only 20 mins 
Ibis Styles Milano Palmanova, We had an awesome experience at this hotel the room was very nice with modern furniture and a really big and comfy bed Everything was clean they changed the towels everyday and was happy to see that we even had a hair dryer in the bathroom The temperature was perfect in the room as the heating was turned on which was unexpected but a big plus for this considering that we went there in April The hotel it s really close to the metro station so 1 minute max of walking The breakfast was excellent you can chose from a variety of foods omelette cereals jam butter cheese yogurt salads fruits pastry and coffee of your own choice juices water All in all I would not hesitate to come back here 
Ibis Styles Milano Palmanova, very close to metro station easy to reach The receptionists were very kind and compliand
Ibis Styles Milano Palmanova,No Positive
Ibis Styles Milano Palmanova, Clean and attractive rooms Proximity to Metro 
Ibis Styles Milano Palmanova,No Positive
Ibis Styles Milano Palmanova, Friendly staff
Ibis Styles Milano Palmanova, Nice sized rooms clean friendly staff Good price quality
Ibis Styles Milano Palmanova,No Positive
Villa Eugenie, Location is central accessible by train parking is a challenge 
Villa Eugenie, Nothing
Villa Eugenie, Near bus terminal
Villa Eugenie, Good place 
Villa Eugenie,No Positive
Villa Eugenie, Didier was friendly and good 
Villa Eugenie, This hotel was terrible this place worst place in paris Hostel is better than this place I m sorry for myself to spend my time in this place
Villa Eugenie, The room was cozy and pretty
Villa Eugenie, This hotel is worst hotel Its terrible 
Villa Eugenie, Nothing 
Villa Eugenie, Nice flexible staff 
Villa Eugenie, The staff were helpful 
Villa Eugenie, Friendly staff accommodating reception personal and very clean rooms 
Villa Eugenie, i think that the hotel is well positioned because i could access all the tourist places withouth any difficulties having to find clean bedding every day it was impressive for me the room was sparkingly clean of which i liked very much 
Villa Eugenie, The staff was helpful especially Aida when we checked in loved the decor Actually my grandson I was a little hesitate about staying away from main tourist attractions but as it was our last day so we really enjoyed getting to know the locals the quaint shops in the area more Besides it was closer to the airport they had a shuttle that got us there in plenty of time 
Villa Eugenie, The staff tried 
Villa Eugenie, Location friendly staff cell phone for use during stay in Paris
Villa Eugenie,No Positive
Villa Eugenie,No Positive
Villa Eugenie,No Positive
Villa Eugenie, need more options in breakfast
Villa Eugenie, It was a terrible stat unfriendly staff very unprofessional and dirty rooms
Villa Eugenie, Amazing
Villa Eugenie,No Positive
Villa Eugenie, the room was very french and beautiful it was good location and I enjoyed to stay there
Villa Eugenie, Front office is helpfull
Villa Eugenie, For a 4 stars hotel we expected more
Villa Eugenie, Too noisy 
Villa Eugenie, bed was confy central friendliy staff
Villa Eugenie, Room and breakfast
Villa Eugenie, the place was very clean and quite
Villa Eugenie, Location is central accessible by train parking is a challenge 
Villa Eugenie, Nothing
Villa Eugenie, Near bus terminal
Villa Eugenie, Good place 
Villa Eugenie,No Positive
Villa Eugenie, Didier was friendly and good 
Villa Eugenie, This hotel was terrible this place worst place in paris Hostel is better than this place I m sorry for myself to spend my time in this place
Villa Eugenie, The room was cozy and pretty
Villa Eugenie, This hotel is worst hotel Its terrible 
Villa Eugenie, Nothing 
Villa Eugenie, Nice flexible staff 
Villa Eugenie, The staff were helpful 
Villa Eugenie, Friendly staff accommodating reception personal and very clean rooms 
Villa Eugenie, i think that the hotel is well positioned because i could access all the tourist places withouth any difficulties having to find clean bedding every day it was impressive for me the room was sparkingly clean of which i liked very much 
Villa Eugenie, The staff was helpful especially Aida when we checked in loved the decor Actually my grandson I was a little hesitate about staying away from main tourist attractions but as it was our last day so we really enjoyed getting to know the locals the quaint shops in the area more Besides it was closer to the airport they had a shuttle that got us there in plenty of time 
Villa Eugenie, The staff tried 
Villa Eugenie, Location friendly staff cell phone for use during stay in Paris
Villa Eugenie,No Positive
Villa Eugenie,No Positive
Villa Eugenie,No Positive
Villa Eugenie, need more options in breakfast
Villa Eugenie, It was a terrible stat unfriendly staff very unprofessional and dirty rooms
Villa Eugenie, Amazing
Villa Eugenie,No Positive
Villa Eugenie, the room was very french and beautiful it was good location and I enjoyed to stay there
Villa Eugenie, Front office is helpfull
Villa Eugenie, For a 4 stars hotel we expected more
Villa Eugenie, Too noisy 
Villa Eugenie, bed was confy central friendliy staff
Villa Eugenie, Room and breakfast
Villa Eugenie, the place was very clean and quite
Bloomsbury Palace Hotel,No Positive
Bloomsbury Palace Hotel, The location of the hotel 
Bloomsbury Palace Hotel, Excellent breakfast extremely helpful staff
Bloomsbury Palace Hotel, The receptionist checking us is was very helpful good knowledge of area Breakfast freshly made to order and very tasty Hotel in good location 15min walk from St Pancras and about 5mins walk to the British museum 
Bloomsbury Palace Hotel,No Positive
Bloomsbury Palace Hotel, Position close to underground station linked to airport connections 
Bloomsbury Palace Hotel, Good breakfast and clean bathroom Free wi fi 
Bloomsbury Palace Hotel, The staff were helpful and friendly
Bloomsbury Palace Hotel,No Positive
Bloomsbury Palace Hotel, After I got some yogurt and fruits and finished them the nice staff brought me toasts and asked me about what I would like for my breakfast It s delicious sufficient 
Bloomsbury Palace Hotel, Staff were helpful as wanted breakfast before the official stat time
Bloomsbury Palace Hotel, Location management reacted well on a complaint
Bloomsbury Palace Hotel, the locationh
Bloomsbury Palace Hotel,No Positive
Bloomsbury Palace Hotel, Internet worked really well Shower had good stream and lots of hot water Breakfast was pretty good 
Bloomsbury Palace Hotel, Very pleasant and helpful staff good location working wifi 
Bloomsbury Palace Hotel, Location was very central And I am sure none basement rooms may of been quieter
Bloomsbury Palace Hotel, quiet room at back of hotel the fact it wasn t a high rise hotel free wifi
Bloomsbury Palace Hotel, Nothing only attribute is the proximity to access to fairly central London 
Bloomsbury Palace Hotel, Great central location for a London visit with lots of very good restaurants and bars in the side streets and 2 minutes from the British museum luggage holding after check out was a very efficient tagged system
Bloomsbury Palace Hotel, Good location Tube station is a 5 minute walk and can get you into Leicester Square within 2 stops Breakfast was basic but nice 
Bloomsbury Palace Hotel, I loved the view out the window over the garden The room was tiny which I had expected but comfy and the wifi worked seamlessly Breakfast was hearty and and served with a smile 
Bloomsbury Palace Hotel, Good location Room was quiet 
Bloomsbury Palace Hotel, Proximity to where I needed to be the following day Good breakfast 
Bloomsbury Palace Hotel, Great location very near to British Museum and just a short walk to Oxford Street The room was very quiet and overlooked the garden area The reception staff were very friendly 
Bloomsbury Palace Hotel, The hotel is close to Euston Station and the Northern line and easy walking distance to many attractions 
Bloomsbury Palace Hotel, The location was perfect for sight seeing breakfast was fine
Bloomsbury Palace Hotel, Excellent location for where I needed to be 
Bloomsbury Palace Hotel, Excellent breakfast menu In room safe Good powerful shower 
Bloomsbury Palace Hotel, I liked the design of the rooms the friendly staff and the good cooked breakfast on the morning The single rooms are very small but very clean and functional for a short break The ensuite is well designed 
Bloomsbury Palace Hotel, Not much really it was in ok position but nothing much more than that 
Bloomsbury Palace Hotel, There was nothing to like other than the location We previously stayed at an adjacent hotel so we knew the area well 
Bloomsbury Palace Hotel, Location 
Bloomsbury Palace Hotel, location
Bloomsbury Palace Hotel, The location was the only positive part of the hotel 
Bloomsbury Palace Hotel, Great location Right next to public transport and welcoming staff Clean rooms and complementary breakfast is good 
Bloomsbury Palace Hotel, The location to the theatre
Bloomsbury Palace Hotel, General niceness of stuff although one had the impression these days it s more important to be fluent in Russian than in English at London s hotels lobbies The bathroom was surprisingly ok and clean although small and with very low quality towels 
Bloomsbury Palace Hotel, Location Clean room 
Bloomsbury Palace Hotel, The staff did all they could to help but the problems were out of there control 
Bloomsbury Palace Hotel, The hotel left some flowers and a bottle of Prosecco for my girlfriends 50th birthday A really nice touch thank you I will drop them a thank you message when I get a mo as I appreciated it I would stay again Breakfast was good too and the rooms very quiet 
Bloomsbury Palace Hotel, Breakfast
Bloomsbury Palace Hotel, Location was Great 
Bloomsbury Palace Hotel, Staff is friendly Breakfast is good 
Bloomsbury Palace Hotel, Very friendly and helpful staff and tasty breakfast As for the hotel itself it has pretty good location and it s quite easy to find the property 
Bloomsbury Palace Hotel, Breakfast was really good
Bloomsbury Palace Hotel,No Positive
Bloomsbury Palace Hotel, Staff very nice and helpfull
Bloomsbury Palace Hotel, The room was very comfortable and clean including a fan which was needed while the weather was so hot The shower was great 
Bloomsbury Palace Hotel, Good location within walking distance to the main Londons attractions To the metro by foot can go no more than 7 minutes Good English classic breakfast fried or scrambled eggs fried tomatoes mushrooms beans There are fruits coffee juice yogurt All tasty and fresh Attentive friendly staff 
Bloomsbury Palace Hotel, Location location location Five minutes walk from Goodge Street station Northern Line five minutes walk to British Museum and ten minutes walk to Seven Dials and Covent Garden with all it s shopping shows and restaurants 
Bloomsbury Palace Hotel, Great location Small room but all facilities Friendly staff and good service 
Bloomsbury Palace Hotel, The shower was very good
Bloomsbury Palace Hotel, Modern room is nice But bed far too small and narrow for a couple Meaning my partner had to sleep in the other bed Lucky we had a triple
Bloomsbury Palace Hotel, I like some of the staff who did their best 
Bloomsbury Palace Hotel, The location of this hotel is relatively convenient if you re just looking for somewhere to put your head for a few hours after a night out Make sure to either take earplugs or get blind drunk before turning in though 
Bloomsbury Palace Hotel,No Positive
Bloomsbury Palace Hotel, The place was conveniently close to our professional meeting location The hotel staff is friendly 
Bloomsbury Palace Hotel, There were none And when the coffee ran out the staff didn t want to replace it I had to ask twice 
Bloomsbury Palace Hotel, Friendly staff at reception
Bloomsbury Palace Hotel, Smallest room I ve ever been in it s like I m in Harry Potter s closet under the staircase That being said this place is just what you need for a short short notice trip to Central London on a budget my room was 75 Breakfast is also included and it s a pretty good one too full English so that s another 5 10 value right there Overall I m happy 
Bloomsbury Palace Hotel, Breakfast was freshly cooked bit short staffed first morning Second morning was fine 
Bloomsbury Palace Hotel, Good convenient location WiFi worked well 
Bloomsbury Palace Hotel,No Positive
Bloomsbury Palace Hotel, Historical location close to all the action Could walk everywhere or get bus easily Felt safe travelling on my own Lovely staff and breakfast Very clean and great value for money 
Bloomsbury Palace Hotel, Close to the West end and the location of my seminar 
Bloomsbury Palace Hotel, Lovely staff
Bloomsbury Palace Hotel, The cooked breakfast 
Bloomsbury Palace Hotel, Room was very well equipped with all the modern appliances and clean Reasonable room size I was with my little daughter and booked a single room but have written to the hotel that we will be 2 It was very nice of them to provide me a room with double bed for the same price It was good to have an English breakfast included in the room price 
Bloomsbury Palace Hotel, Cosy attic room for 1 on the top floor I felt very safe 
Bloomsbury Palace Hotel, The location is brilliant making it easy to get to places that we needed to 
Bloomsbury Palace Hotel, Location clean bathroom
Bloomsbury Palace Hotel, Excellent service They went extra mile to give us the fan in hot weather of London We arrived early but the room was ready and they let us have the early check in 
Bloomsbury Palace Hotel, Bathroom was small but you get what you pay for Also dont ask them to call you a taxi They have some people called city ryders they call and their price is absurd to take you to airport 
Bloomsbury Palace Hotel, comfy bed nice shower clean and tidy
Bloomsbury Palace Hotel, Enjoyable breakfast Comfortable and clean room Great location to either walk into central or underground very near by Friendly staff It is a good hotel for the price 
Bloomsbury Palace Hotel, Really enjoyed staying at this hotel warm very modern shower great so was the TV bed very comfortable and only 10 minutes from the dominion theatre and Oxford street would definitely visit again
Bloomsbury Palace Hotel, When I checked out 
Bloomsbury Palace Hotel, Leaving the hotel 
Bloomsbury Palace Hotel, Just a short walk away from the New London Theatre and other attractions Breakfast was cooked fresh and made to order 
Bloomsbury Palace Hotel, Location is excellent good for a short stay Good value for money
Bloomsbury Palace Hotel, Excellent location in walking distance from oxford street regent street Very close to the British Museum and Goodge metro station Full english breakfast nice staff and very good prices for central London 
Bloomsbury Palace Hotel, Near by Kings Cross station You can pretty much walk to all those tourist spots 
Bloomsbury Palace Hotel, Enjoyed the hot breakfast and selection room cozy and complete with amenities appreciated being able to have hot tea coffee shortbread cookie Staff professional in its concierge duties
Bloomsbury Palace Hotel, The location near the British Museum and Soho
Bloomsbury Palace Hotel, Free WiFi and decent breakfast on offer More than enough coffee and biscuits in room Clean
Bloomsbury Palace Hotel, nothing
Bloomsbury Palace Hotel, Good location and great breakfast Very clean Very good value for money The complimentary tea and coffee tray was a welcome bonus 
Bloomsbury Palace Hotel, Location
Bloomsbury Palace Hotel, Really friendly staff both reception and breakfast room 
Bloomsbury Palace Hotel, Location easy access to Underground
Bloomsbury Palace Hotel,No Positive
Bloomsbury Palace Hotel, The proximity to the tube and neighborhood was great Easy to get anywhere in London Felt safe walking alone at night 25yo female 
Bloomsbury Palace Hotel, The location
Bloomsbury Palace Hotel, Amazing location reasonable price friendly staff 
