Hotel_Name,Positive_Review
Hotel Cavendish, The hotel is placed excellently as it is surrounded by 3 tube stations on different lines and is easily in walking distance of The British Museum and not far from Leicester Square either if you don t mind a stroll We even walked to King s Cross Station from the hotel The staff were really helpful and allowed us to leave our luggage in reception the day we arrived whilst we went exploring the city and offered to hold our luggage on the day we left as well Breakfast was pleasant and the staff were happy to assist Our room was situated at the back of the property and so there was little noise considering the road the hotel is on Overall a pleasant stay and I would recommend it to others who are going to London and want a central but budget friendly hotel 
Hotel Cavendish, This property was not up to any standards I did not like anything in this hotel 
Hotel Cavendish, The staff was extremely helpful and accommodating to my requests Excellent 
Hotel Cavendish, The staff were friendly and in a good location Despite being in the town centre it was relatively quiet in the room we were on the top floor 
Hotel Cavendish, Location
Hotel Cavendish, Location Staff were very friendly Room was kept tidy 
Hotel Cavendish, Very central
Hotel Cavendish, The bed was really comfortable 
Hotel Cavendish, The staff were attentive and responded to our requests 
Hotel Cavendish, Pleasant staff at desk
Hotel Cavendish,No Positive
Hotel Cavendish, it was close to Euston Station and easy to get to other areas
Hotel Cavendish, the room is big close to train and tube station good full English breakfast 
Hotel Cavendish, I couldn t find a better location at that price I had the cabin the smallest room I could find and I loved it I didn t need anything more I wish all the hotels had that option The breakfast was ok although I would have liked porridge and they didn t have any The staff was very friendly and helpful I already knew they didn t have a lift so I was prepared with the kind of luggage to carry with me 
Hotel Cavendish, It is a very central location and therefore good for tourists or if like me you go to Camden on nights out it is a fairly affordable option for staying the night instead of a long night bus or night tube journey home Facilities are also pretty good and staff are friendly 
Hotel Cavendish,No Positive
Hotel Cavendish, It was very convenient to two tube stops grocery bookstore British Museum British Library University of London and very walkable to areas around The double room was small but comfortable for one person It could have used a deep clean around the baseboards sill and doors but otherwise was well attended to daily The reception area could use some work as it doesn t leave a good impression but in the end it was fine and the staff were very friendly and helpful I would stay there again 
Hotel Cavendish, Nothing 
Hotel Cavendish, Bed very comfortable and laundry good Breakfast good Service overall very good Location very convenient and places from Regents Park to West End all within 20 mins walk 
Hotel Cavendish, Breakfast 
Hotel Cavendish,No Positive
Hotel Cavendish, Wonderful location friendly staff 
Hotel Cavendish,No Positive
Hotel Cavendish, It was clean and tidy and the room was a nice size It was quiet and the breakfast was quite nice 
Hotel Cavendish, Clean sheet and bed Clean bathroom Good location But do not expect more 
Hotel Cavendish, Location of hotel chosen by us 
Hotel Cavendish, The location was handy and the staff were quite pleasant The bed was comfortable 
Hotel Cavendish,No Positive
Hotel Cavendish, Only the location 
Hotel Cavendish, I was in a cabin room small but had everything I needed Couldn t believe how quiet it was at the back overlooking a bit wild garden Quiet within the hotel too Didn t hear anyone getting up ridiculously early which seems to be my experience in the big chain hotels I had paid 85 for a night in central London including free wifi and decent fresh breakfast Fabulous value 
Hotel Cavendish, The location was great and the hotel staff were lovely The breakfast was also nice 
Hotel Cavendish, Except the location everything was poor 
Hotel Cavendish, Central location
Hotel Cavendish, The breakfast was served efficiently and the location of the hotel was good 
Hotel Cavendish,No Positive
Hotel Cavendish, Staff friendly
Hotel Cavendish, The location is great it s an easy walk to both the Goodge and Warren tube stations I have no comment on the breakfast as I only had toast My room a single was extremely small but that s a warning more than a criticism It s not uncommon for British hotels to have very small rooms 
Hotel Cavendish, We liked the location to central London 
Hotel Cavendish, I visited the Cavendish with my wife last weekend we had a wonderful stay We where greeted by Omar who was very friendly and was always at hand to help and make our stay happy and relaxing and telling us the best places to go locally At breakfast the staff was ensuring we was well fed and comfortable and served a lovely English breakfast although there is a lovely choice if you prefer a choice The hotel is well placed and only a short walk from Euston Station It is within reach of all of London s famous areas to visit within a 20 minute walk or a short walk to an underground station We both found the hotel a comfortable place to stay and it was the the staff made it that way always asking are the rooms ok and comfortable I would recommend this place to stay in London it is ideal for weekend breaks Thank you Omar and the staff you do a great job at making sure our stay was a lovely one regards Ian
Hotel Cavendish, Breakfast The breakfast was very good Full English breakfast eggs at our own likings beans bacon sausage tomato coffee tea toasts jams There s also options for cereals n some fruits n juices Location The location was very good Close distance to all the major tube stations Warren St Station Euston Sq Station and Euston Railway St It s also about 15min walk to this one intersection where there s a lot of good food we ate at Kanada Ya Ramen Bar highly recommended if you like asian noodle soup It s about 10 15min walk from British Museum The bus stop across the street also goes to Trafalgar Sq which we took to get amazing deal on the Lion King Show Staffs The staff made were nice we arrived around 10pm he saw that I was pregnant so he switched us into a bigger room Rooms They clean the room everyday make bed replace towels There s also kettle n tea coffee in the room n some crackers which I believe they were complimentary 
Hotel Cavendish, good location but otherwise not recommendable 
Hotel Cavendish, The recepcionist are ok
Hotel Cavendish, Staff were helpful The hotel has all the basics that are needed It is a bit worn looking so if you need updated this may not be for you The English Breakfast was wonderful eggs to order Location was convenient to British Museum and other attractions all within a 20 min walk 
Hotel Cavendish, Location of the property was good close to transport links Room was comfortable and just what was needed for our stay 
Hotel Cavendish, The location of this property is great It s convenient to St Pancras Station the British Library the British Museum and many other delights of Bloomsbury For a short stay in which you plan to be out sightseeing all day and evening and only need a place to sleep at night the Hotel Cavendish would be a good base One advantage it has over some of the other Gower Street hotels is that the windows are double paned so that the street noise was reduced There was also a fan in the room which was useful because the room was very close and stuffy The wireless was speedier and more reliable than some other budget hotels I ve stayed in There was very little noise audible through the walls which was a relief as this is sometimes a problem in these older hotels 
Hotel Cavendish, Good location English breakfast which was very nice Complimentary coffee tea and cookies in the room Friendly staff Wireless Lan was excellent there are routers on every floor and it was very stable 
Hotel Cavendish, No croissants available at breakfast
Hotel Cavendish,No Positive
Hotel Cavendish, Nothing
Hotel Cavendish, Bed comfy and clean Great location 
Hotel Cavendish, Very friendly staff and the girls at breakfast worked quickly and efficiently Good sized room with big bed and comfy sofa Shower room small but good powerful shower 
Hotel Cavendish, Please make yourself a favor and avoid The photos on booking com has nothing to do with this hotel Old building v small rooms shower not working properly phone in the room not working it was hot in London those days And you could not open the windows very noisy street and rooms are not isolated the TV is old as well On top of that it is not cheap I booked this hotel in a rush and it was a big mistake Never again I believe a lot of hotels in London should be reported They are advertised as 3 or 4 stars and they do not deserve even a star 
Hotel Cavendish, Located near Oxford str 
Hotel Cavendish, Location Close yo theatre land about a 10 minute walk Choose a different hotel in this area 
Hotel Cavendish, location was good staff reasonably helpful 
Hotel Cavendish, Great location room okay size Nice double bed A little out dated but great value for money Room was very quiet and nice temperature Breakfast nothing special but filling Small english breakfast with your choice of eggs Breakfast room small but we never had to wait for than two minutes Just a short walk to Oxford Street and everything London has to offer 
Hotel Cavendish, Free wifi
Hotel Cavendish, Horrible place Sorry and ran down Really poor experience for a 3 star as advertised
Hotel Cavendish, Fantastic area very central Good tube links Polite staff 
Hotel Cavendish, Location Nice staff 
Hotel Cavendish, Only the position of the hotel 
Hotel Cavendish, Great little place to stay at a fraction of the cost of other hotels we have used in london we stayed for 2 nights and have nothing bad to say comfy bed free wifi and a good little english breakfast Very happy and helpful staff 
Hotel Cavendish, Room was spacious and clean Beds comfortable Got a kingsize and a double bed which was better than expected We thought a double bed and a single Room was for myself my daughter and my niece Shower room toilet was clean although shower curtain a bit grubby looking Clean towels each day and top up of tea coffee Would stay again as nothing was very bad All in all a pleasant stay 
Hotel Cavendish, Being moved to the room I booked on the second night Breakfast very good 
Hotel Cavendish, The room was comfortable for our stay Clean and modern Reception staff were friendly and helpful 
Hotel Cavendish, The hotel was located 5 minutes away from Euston station in a quiet and peaceful area quite close to a number of different amenities The breakfast was acceptable The receptionist Patel was exceptionally helpful and friendly 
Hotel Cavendish, Nothing
Hotel Cavendish, Breakfast was way above the low standard of the hotel 
Hotel Cavendish, The staff were polite The breakfast excellent for the start of the day The hotel was central and reasonably priced for what we wanted Would definitely use this hotel again Hoping to go bk in November its not luxury but it is clean and comfortable 
Hotel Cavendish, I needed accommodation at very short notice and they had a room available It was described as a cabin and that is a fair description of the smallest room I ve had since a school trip ferry to Gothenburg 
Hotel Cavendish,No Positive
Hotel Cavendish, Good freshly cooked breakfast with choice of items Perfect location for British Museum public transport including Piccadilly Line direct from Heathrow and both West End and City East End 
Hotel Cavendish, The breakfast at the hotel was fine The location was great as your not far from a lot of attractions and links around London The hotel staff were very nice and extremely helpful 
Hotel Cavendish, Nice area
Hotel Cavendish, Comfortable beds Friendly staff Small rooms and bathroom Not a WOW factor Close to the british museum OK breakfast 
Hotel Cavendish, Location was good they changed the towels everyday 
Hotel Cavendish, Location was good near to Euston station Good breakfast served promptly and with a smile
Hotel Cavendish, No bad location 
Hotel Cavendish, The location was quite convenient
Hotel Cavendish, Great location Breakfast was tasty
Hotel Cavendish,No Positive
Hotel Cavendish, very close to the city walking distance
Hotel Cavendish, I had a tiny cabin room but the layout was great it was very clean and despite size very comfortable I thought it d be windowless but it had a window The bed is single size Great value for money The location is amazing 
Hotel Cavendish, My first experience of a cabin bedroom in London that actually worked Well laid out with everything you need including a decent hairdryer Reception and breakfast room staff were pleasant and helpful Good freshly cooked breakfast items A good location for my meeting and British Museum exhibition Lovely hot shower 
Hotel Cavendish, The location was ideal for us The beds were comfortable 
Hotel Cavendish, Bed comfortable Shower good and hot 
Hotel Cavendish, The bed and sofa were very comfortable and the location was super 
Hotel Cavendish, Very light scrambled eggs Friendly staff Good location
Hotel Cavendish, Bed was good
Hotel Cavendish, Breakfast good
Hotel Cavendish, The room was adequate and clean for a one night stay 
Hotel Cavendish, Room was nice and big for a London hotel friendly and helpful staff location was very handy for access to town centre by foot or tube 
Hotel Cavendish, It was near my venue for the next day The bed was very comfortable The staff exceptionally pleasant and helpful Breakfast ample and good choice My room was clean and I had a good TV 
Hotel Cavendish, Friendly staff lovely breakfast perfect location 
Hotel Cavendish, I liked the location and staff on the reception 
Hotel Cavendish, Reception desk staff were lovely polite and credit to the hotel Good location
Hotel Cavendish, Good location
Hotel Cavendish, NOTHING
Hotel Cavendish, good location reasonably priced The staff were friendly Breakfast was very good Really liked that if you are a coffee drinker you got a pot of coffee and not just a mug like some places Room was small but what do you expect when you book a cabin room 
Hotel Cavendish, Short walk to tube buses and boris bikes Great location though we walked from hotel to London eye and going the other way as far as Camden Market Only 35mins walk Room was a decent size considering the price and location Expected a box room but was more than comfortable size 
Hotel Cavendish, Location and small and intimate other than the ants was clean and comfortable
Hotel Cavendish, The breakfast was lovely love the scrambled eggs
Hotel Cavendish, With a little bit of upkeep of the property example whitewash of walls doors of rooms need to be looked into safe in room in wardrobe but on the floor so it is difficult to operate these little things that matter and they could easily be done Otherwise we a very good time Rooms clean staff helpful b fast good 
Hotel Cavendish, All good room clean and comfortable I might make this my London base Close to Goodge St on Northern line 
Hotel Cavendish, The location is perfect for attractions Underground is close Staff are very friendly and helpful 
Hotel Cavendish, Quiet house cheerful friendly staff very good breakfast very reasonable price convenient for the University and British Museum 
Hotel Cavendish, The breakfast was good good choice for continental if not a bit basic the cooked breakfast was fresh and very tasty 
Hotel Cavendish, The location close to the theatre we were visiting
Hotel Cavendish, Location
Hotel Cavendish, Nothing
Hotel Cavendish, Friendly staff very good location just a few minutes walking of the British museum good English breakfast At the end of February and no need for heating but was cold outside No traffic sounds at the back of the building WiFi Ok
Hotel Cavendish,No Positive
Hotel Cavendish, It was reasonably priced in a good location Quieter than expected Clean and comfortable but not luxurious Ideal just to sleep and breakfast before more sightseeing 
Hotel Cavendish, The hotel was very central and area was good would recommend for ease of walking around the city centre Great that there was cover on reception 24 hours 
Hotel Cavendish, The breakfast was ordered from us and served very quickly 
Hotel Cavendish, The curtains were nice 
Hotel Cavendish, Location to Euston station is good and breakfast selection was ok 
Hotel Cavendish, The Staff was very friendly The room was warm and Nice The location is very good In just a few minutes you ll be in Oxford Street or the brittish museum And there is a lot of restaurants very near the hotel They let us keep the luggage in the reception our last day that was very good 
Hotel Cavendish,No Positive
Hotel Cavendish, We were allowed to leave our things before checking in however this felt unsafe Not locked away or marked with our names or anything 
Hotel Cavendish, Staff is helpful and very friendly Location is excellent Breakfast is good 
Hotel Cavendish, Breakfast okay everything else very poor 
Hotel Cavendish, hotel workers were good and helpfull location is definatelyy perfect 
Hotel Cavendish, The room was clean and no smell at all I really appreciated the free water bottle waiting for me Full English breakfast was included and is was very quick and lovely
Hotel Cavendish, the location and the price
Hotel Cavendish, Very friendly staff 
Hotel Cavendish, Breakfast ready before first sip of coffee Friendly staff Clean tidy 
Hotel Cavendish, Bed was ridiculously comfortable and the shower was fantastic Breakfast facilities were excellent with prompt and attentive service
Hotel Cavendish, Breakfast very good friendly efficient staff Good choiceof menu Reception staff friendly and helpful Only 5 mins walk from Euston Square Tube Station Single room I was in adequate though bit on the drab side
Hotel Cavendish, The staff were very friendly and kind Room was great had everything we needed Great location for theatre goers 
Hotel Cavendish, Good breakfast freshly cooked Staff very friendly 
Hotel Cavendish, Perfect location I had to travel around London for meetings in different places the perfect location of the hotel allowed me to easily commute with the tube and on foot 
Hotel Cavendish, Location is superbly central and allows easy access to all attractions 
Hotel Cavendish, The hotel was warm with good Wifi close enough to Euston and close to a tube station Very good value for money 
Hotel Cavendish, There was one particular guy at the desk during the day who was very helpful and patient
Hotel Cavendish, The room and the bed were really nice Had a little TV It was lovely that I could walk to Camden market or to the city centre from the hotel as you were so close I everything I managed to walk 15k when I stayed here Brilliant
Hotel Cavendish, For 75 b b can t really complain although room was little more than a cupboard Room was warm enough and generally clean The staff were friendly The breakfast was perfectly adequate 
Hotel Cavendish, The staff in the restaurant are really kind 
Hotel Cavendish, The staff were very friendly and helpful Breakfast was very good plenty of choices The bed was very comfy The bathroom was small but had everything you needed and was clean It was in a good area for the underground and quite a few of the tourist attractions I would definitely go and stay there again 
Hotel Cavendish,No Positive
Hotel Cavendish,No Positive
Hotel Cavendish, The staff were very friendly and helpful Breakfast was good 
Hotel Cavendish, The breakfast it was ok 
Hotel Cavendish, Not a 4 Star Hotel 3 at best But a good price for a great location so would recommend as bed was comfy 
Hotel Cavendish, Very clean room Very central few mins walk from oxford street Very good for the money paid 
Hotel Cavendish, Nothing Dirty Rude staff No customer service I rate this as a one star NOT a four star Don t waste your money awful 
Hotel Cavendish, Very easy travelling from kings cross and well situated close to the underground but easy to get a taxi also staff very helpful 
Hotel Cavendish, Friendly staff Good breakfast Very clean and good bathroom for size of the room 
Hotel Cavendish, Reception staff was friendly Very close to UCL Kings Cross Oxford street and Covent Garden Bed was quite comfy I could leave my luggage after checking out Good that breakfast was included
Hotel Cavendish, The room was good and comfortable Staff were friendly and helpful 
Hotel Cavendish, The location was great walking distance to Goodge Street tube station under 5 minutes Russell Square tube station about 10 minutes and the heart of the theatre district 15 minutes Breakfast was nice full English breakfast available and made to order as well as a selection of cereals yogurt and fruit The room was incredibly quiet I heard no noise from the stairway other rooms or the garden 
Hotel Cavendish, well the hotel was close to everything 
Hotel Cavendish, friendly staff room size for a city centre hotel of this size was larger than expected staff happy to look after bags before and after use of room 
Hotel Cavendish, Nothing 
Hotel Cavendish, Bed was good staff and location was good
Hotel Cavendish, 1 The location is very central Oxford St British museum lots of buses to go elsewhere 2 It is possible to leave the luggages at the frontdesk on the day of departure without any fee 3 Calm bedroom we were on the 2nd floor view on the garden and warm room
Hotel Cavendish, We booked a double room hiwever bed was a little bit bigger than songle Room very small
Hotel Cavendish, The staff were helpful particularly on arrival Breakfasts were good and freshly cooked In terms of London prices it was fairly good vfm 
Hotel Cavendish, Excellent location close to all public transport the British Museum and the shopping area Good breakfast it was good but not big 
Hotel Cavendish, great english breakfast nice hot water absolutely perfect location for sightseeing
Hotel Cavendish, Great location clean rooms
Hotel Cavendish, Breakfast was ok 
Hotel Cavendish, The location And the staff were friendly
Hotel Cavendish, This hotel is located in a cozy and quiet place Breakfast was just ok 
Hotel Cavendish, Location perfect and having paid 75 for a night it was very good value
Hotel Cavendish, Excellent location and breakfast every morning 
Hotel Cavendish, If there s anything good its probably the receptionist Tough to be working in such a strenous condition and still greet people with a smile 
Hotel Cavendish, Very small 
Hotel Cavendish, The rooms were ok
Hotel Cavendish, Great freshly cooked breakfast great location in central London Cabin rooms are what they say small rooms Only downside is the window is not double glazed so bit drafty ok in these warmer days 
Hotel Cavendish, Good room size on quiet side of hotel Excellent breakfast 
Hotel Cavendish,No Positive
Hotel Cavendish, Plus point it s in London with friendly staff 
Hotel Cavendish, Location was really good The man on arrival was really friendly and helpful The room was basic but comfortable It was a different man when we left who was just ok barely glanced our way Praise goes to the check in man the comfort of the bed and the location 
Hotel Cavendish,No Positive
Hotel Cavendish, Leaving 
Hotel Cavendish, Room was extremely cold asked for blanket and was given a bed sheet that wasn t helpful Wifi never worked in room and both rooms they did change me to an equally cold room were not properly cleaned 
Hotel Cavendish, Staff The receptionist was extremely nice and helpful Location Descent location close to underground and basically in the heart of London with many youngsters around university nearby 
Hotel Cavendish, Very nice staff both at the reception and in the kitchen Very good localisation in the heart of London Decent internet speed in WiFi
Hotel Cavendish, Basic accommodation but in an excellent location Clean Staff were friendly helpful Facilities were adequate for needs on this occasion 
Hotel Cavendish,No Positive
Hotel Cavendish, nothing
Hotel Cavendish,No Positive
Hotel Cavendish, The staff were very pleasant and the hotel is nicely decorated 
Hotel Cavendish, Location was excellent Breakfast and staff were very good Room was spacious and warm Bed was comfortable 
Hotel Cavendish, I really loved this hotel the staff were incredibly welcoming helpful and kind I had a tiny but perfectly formed room the location was amazing and breakfast was really very good All in all it was excellent value and I will be returning 
Hotel Cavendish, Staff were friendly and wifi was efficient 
Hotel Cavendish, Close to Euston and UCL hospital which was the reason for our visit 
Hotel Cavendish, Good location Easy short walk to Euston Station Oxford St British Museum Covent Gardens Madamme Tussauds etc 
Hotel Cavendish, The hotel was convenient for Euston The room and the bed were nice The biscuits were nice The tea was fine Good WIFI
Hotel Cavendish, Location 
Hotel Cavendish,No Positive
Hotel Cavendish, only the location and the breakfast
Hotel Cavendish, Great breakfasts Location was fantastic for me 
Hotel Cavendish, For 95 I expected at least a wardrobe It was detailed as a cabin room but small size not stated Got upgrade ok but others need to be aware of this in room description
Hotel Cavendish, It was in a good locations braskfast was fine 
Hotel Cavendish, Really friendly staff who gave a very warm welcome and were really helpful 
Hotel Cavendish, Tiny room which I expected I was very impressed by the facilities in it and the layout Clean and comfortable Nice hot shower Nice welcome from reception 
