Hotel_Name,Positive_Review
Henry VIII, The location is really great Just next to Hyge Park with easy access to city center by public transport with bus stops and metro just next to the hotel The stuff on reception are really friendly I enjoy their Spanish spirit everytime I stay in the hotel The breakfast is good don t miss it 
Henry VIII, Breakfast was a good spread each morning Although you ran out of tea bags on 2 occasions by 9 30am so I had 2 mornings without my cup of tea 
Henry VIII, Only the location was ok 
Henry VIII,No Positive
Henry VIII, We enjoyed most of the hotel really although thing I had ordered for never materialised we therefore wouldn t re book to stay again
Henry VIII, Great location for us A 10 minute walk from Paddington and a five minute walk from Bayswater tube station My daughter loved the pool and the breakfast had a great selection 
Henry VIII, the location of the hotel
Henry VIII, The hotel was in an excellent location Less than five minutes walk from Queensway tube station Two minutes from a garage which was handy for snacks The staff were more than helpful and very friendly Spoke both English and Spanish We checked out at 11am and our flight wasn t until 8pm but the hotel hold the luggage so we didn t have to lug it around London 
Henry VIII, No the croissants were not of good quality The beds were ok 
Henry VIII,No Positive
Henry VIII, The breakfast had a good range of choice and the pool was nice and clean The location is good very handy for Kensington Gardens Hyde Park and two or three underground stations 
Henry VIII,No Positive
Henry VIII, the swimming pool was very good the staff friendly and very helpful breakfast first class
Henry VIII, The hotel is good All the staff speak english and spanish and they re all very friendly The breakfast is delicious and it has a good price Also the hotel is well located close to two different Underground metro stations and next to the amazing Hyde Park so you can even go jogging in the morning before starting your day The hotel even includes a swimming pool and a small sauna for relaxing after a long day As an extra treat they offer free apples and water in the lobby 
Henry VIII,No Positive
Henry VIII, Location and parking in The street in front of The hotel The staff wasn T aware of The parking rules On the street
Henry VIII, When I got there late evening I found my double room had been given to someone else They gave me a single room 25 discount so five stars to the manager who did her best to recover the situation fortunately I was alone and did not have to have a double bed 
Henry VIII, The room and bed were warm and relatively confortable 
Henry VIII, Location was fairly good as there were 2 tube stations near by And we enjoyed swiming and sauna even though the water was cold and the sauna was tiny Bed was good not too soft Wifi speed was quite good Even though interior in general needs refurbishment all area was kept very clean 
Henry VIII, Good comfortable beds Staff friendly and attentive Breakfast was good
Henry VIII, Lovely hotel loved the pool and location
Henry VIII, We had paid extra for Breakfast on our three day visit Twice we were left standing at the entrance while staff tried to find out if we we re entitled to eat The manager of the restaurant fail to apologies Embarrassing
Henry VIII, Breakfast was ok 
Henry VIII, Breakfast was varied enough choices for every one Hotel was very easy to find pleasant staff lifts in hotel which made it easy to get to the rooms with luggage Shower and bath facilities were very good Nice quiet area so little noise from outside I would be happy to go back there again 
Henry VIII, Well located breakfast was good staff friendly 
Henry VIII, The service was fast and great we were greeted with a warm welcome The pool area and sauna is really good clean pool is heated and hard to get out of once in The rooms are very basic but you get what you pay for beds are comfy 
Henry VIII, Position and room cleaned 
Henry VIII, Conveniently located hotel close to multitude of restaurants on Queensway and Westbourne Grove although the closest restaurant Zorbas on Leinster Gradens best avoided Friendly welcome Very acceptable room with all the usual refinements kettle tv etc 
Henry VIII, Lovely staff really friendly and helpful bedroom was clean and simple not very big but we only stayed 1 night so big enough for us bed was very comfy and the ceiling fan was good as it was quite warm when we stayed 
Henry VIII, The room was clean the staff were friendly
Henry VIII, room very small noise and crank all night through so we woke up third still definitely not a 4 star hotel and I ve stayed in few four stars around the world its a 2 star as toilet door broken and noisy in much ned of an update the whole place well overdue breakfast soulless and dry eggs tasteless cakes and old would never go back the pictures were deceiving 
Henry VIII, The pool was really nice Beds were comfortable Really nice lady on the first desk 
Henry VIII, The cooked breakfast was excellent and the pool was lovely and warm even better that we had it all to ourselves 
Henry VIII, Nice rooms comfort beds clean good location near bus and underground good wifi connection
Henry VIII, Swimming pool was lovely room was clean beds comfy breakfast good variety powerful shower 
Henry VIII, Nice location with plenty of local shops cafes Really good to have a pool too esp at the price Its a lovely walk through Hyde Park to Buckingham Palace and Whitehall Buses are only a few minutes walk away and go directly to Oxford Road for shopping otherwise use the tube which is also close 
Henry VIII,No Positive
Henry VIII, The location
Henry VIII, For the price the hotel was better than adequate room was fine bed comfortable and the pool and breakfast made for good value 
Henry VIII, Swimming pool and sauna were excellent
Henry VIII,No Positive
Henry VIII, Nothing
Henry VIII, The hotel for what you pay is good good location
Henry VIII, Central location was good as was the pool area Helpful reception staff printed off some documents for me 
Henry VIII, Good location
Henry VIII, Breakfast was very good at the henry viii hotel Nice quiet location 
Henry VIII, Everything was just absolutely fantistic The poor the atmosphere the room was just perfect 
Henry VIII, There was gluten free bread available Buffet breakfast had good choice for most
Henry VIII, To be honest I was disappointed and will never stay there again Watch out for the 27 pound parking bill you have to pay for Although I selected parking on filter looking for hotels and Henry came up on the search with parking what they don t tell you is its 15 mins on foot in an underground dark parking facility not good if your a lone woman visiting 
Henry VIII, Very good location 5 10 min walk to underground and bus stations Everyday cleaning Everyday change of towels Very cheerful and helpful personnel 
Henry VIII, Even after I wrongly accused the house keeping of stealing money from my room the staff at Henry VIII maintained a professional yet empathetic manner Top notch class I highly recommend Henry VIII for location comfort and world class hospitality Sincerely a kind although tired Canadian chic
Henry VIII,No Positive
Henry VIII, The beds were comfy 
Henry VIII, Location was good 
Henry VIII, Location clean easy check in check out
Henry VIII, Lovely street of 19th century appearance Beautiful small hotel with warm swimming pool Close to Paddington station Hyde Park and Royal Albert Hall Friendly staff and good value for money 
Henry VIII, Room nice and clean Old building but presented ok Location ideal for Kensington attractions museums Royal Albert Hall Kensington Palace and Gardens Near to Paddington rail terminus but in a quiet location in a side street Good value if you can book far enough in advance 
Henry VIII, From the outside the building looked lovley however on entering the reception area was a bit outdated 
Henry VIII, The hotel was nice and warm compared to the very cold and windy weather conditions outside
Henry VIII, lovely warm pool sauna breakfast room large and breakfast offered good choice
Henry VIII, I like so much possibility to enter in the spa and in the pool there aren t much hotels that offer this I have been very good in this hotel 
Henry VIII, Room was nice Friendly staff Breakfast was very good 
Henry VIII, The swimming pool was nice as were the staff The cleanliness standards were acceptable for us and the breakfast plentiful Lovely bacon and good fruit 
Henry VIII, Location ideal for Kensington gardens and Hyde Park 15 mins walk from Paddington 
Henry VIII, Location 
Henry VIII, The breakfast in Henry the VIII was excellent Really set us up for the day And the location is great very close by bus stop which would bring you into the city centre in 10 minutes 
Henry VIII, It was a comfortable comfy hotel The lift was good It was quiet and the staff were pleasant 
Henry VIII, Great location and good value accommodation 
Henry VIII, The staff are really helpful and very friendly the wifi was excellent I had to do a lot of work during my stay and I never once experienced a problem with the wifi The bedroom was spotless 
Henry VIII,No Positive
Henry VIII, good location
Henry VIII, When I was looking it Appeared to offer good value for money
Henry VIII, The location was amazing 10 minutes from Oxford street 
Henry VIII, The breakfast on the sunday was far superior to the saturday morning There was a good range of options and the food appeared freshly cooked and prepared The staff were friendly 
Henry VIII,No Positive
Henry VIII, Easy to get to lovely juice and apple in reseption great location to the park and easy walk into town or underground the swimming pool is really nice and warm
Henry VIII, Overall I found the staff to be friendly Location was great five minute walk from Paddington station which was perfect 
Henry VIII,No Positive
Henry VIII,No Positive
Henry VIII, We checked in a little earlier than anticipated and they had no rooms open except for a suite They upgraded us for free The employees were all very nice and cheerful Our room was great and the bed was comfortable The sauna is tiny but great and the pool was refreshing Breakfast included a ton of options and was fantastic The location was 5 minutes to two different metros as well as restaurants grocery stores and currency exchanges Hyde park is a two minute walk away and provides beautiful scenery We had a fantastic time 
Henry VIII, Room was very clean location was great excellent value for money considering the pool sauna Staff was friendly Nice fruit at breakfast 
Henry VIII, The room was warm and clean the hotel is very conveniently located for walking to most places if you like a stroll 
Henry VIII, The location was great really close to the undergrounds and buss stations There were many coffee shops and restaurants around the Bayswater Also the breakfast was really good 
Henry VIII,No Positive
Henry VIII, The only good thing was the location There are lots of shops opened to late 
Henry VIII,No Positive
Henry VIII, A good location in the centre of London
Henry VIII, The location is superior reception working well they are helpful Its nice to have a bath in the room 
Henry VIII, Staff were polite and good location 
Henry VIII, Room OK Bed comfy Nice sheets Swimming pool looked good Staff pleasant and cheery 
Henry VIII, Location is great close to everything big plus Swimming pool is great Sauna was okay
Henry VIII, I liked the comfort of the bed and the location of hotel
Henry VIII, The location is good and the hotel price was good
Henry VIII, Thought the hotel was in a good location 
Henry VIII, Really comfortable all round excellent breakfast Plan to come back at our nearest opportunity Fantastic location will recommend to friends
Henry VIII,No Positive
Henry VIII, Breakfast was good with a good choice and the location was great
Henry VIII, Location was perfect for where I was working at the time 
Henry VIII, Location 
Henry VIII, The bed was comfortable And a range of food for breakfast 
Henry VIII, The location was good and it is easy to find It was clean and adequate for our needs 
Henry VIII, The bed was comfortable room was warm the free wifi was easy to connect and fast Hotel provided complimentary toiletries in the bathroom which was convienient Complimentary chocolates magazines and the large bottle of water was nice Contacted reception due to blocked toilet and a plumber came to assist in less than 5 minutes 
Henry VIII, Nothing at all
Henry VIII, Hotel is situated very close to central London Makes it quitre easy for shopping and to view places of interest 
Henry VIII, Rubbish hotel
Henry VIII,No Positive
Henry VIII, Clean comfortable helpful staff good breakfast small but good pool and sauna good location
Henry VIII, I took my 7year old daughter to see Aladdin and we stayed here for her birthday She cried when we had to check out She didn t want to leave We enjoyed staying here the service food and facilities was fantastic cannot be faulted The only thing is the hotel could do with a bit of modernisation but this would not stop me from coming back as we had a good time 
Henry VIII, Breakfast excellent value We stayed last year and wanted to come back My daughter loves the little swimming pool 
Henry VIII, Nice rooms and hotel overall
Henry VIII, Friendly staff and lobby comfort along with a good location
Henry VIII, It has a lift Which is a godsend in London Paddington area especially when you have a room on 5th floor Very clean Excellent staff WIFI full breakfast included in price 
Henry VIII, Breakfast was good Good location 
Henry VIII, The staff was very kind and helpful always smiling with a great attitude The breakfast was good The room was very clean 
Henry VIII, the swimming pool was a nice addition to the stay
Henry VIII, The 5 10 minute walk from Paddington Underground was really convenient 
Henry VIII, Buffet breakfast was excellent 
Henry VIII, Breakfast was nice Location was nice 
Henry VIII, Not much
Henry VIII, I like the pool and the location 
Henry VIII, The breakfast was very good Plenty to eat and plenty of choice 
Henry VIII, The pool and location
Henry VIII, Always enjoy our stay here The rooms are very nice and we like the whole feel of the hotel The swimming pool and breakfast are particular highlights 
Henry VIII,No Positive
Henry VIII,No Positive
Henry VIII, The hotel is nice and cozy Location is very nice 
Henry VIII, Location is very good 3mns from Hyde Park 10mns from Paddington
Henry VIII, Still wondering 
Henry VIII, Good welcome very convenient location for our visit and generous bathroom 
Henry VIII, Great location close to shops and restaurants and just a short stroll to Hyde Park
Henry VIII, The breakfast was good and the location of fhe hotel convenient 
Henry VIII, breakfast was nice the pool was nice and warm
Henry VIII, Nothing 
Henry VIII, Loved the shower Hot hot hot Breakfast choices was good and the bed was comfy Real radiator so you got proper heat and a window you could open for fresh air 
Henry VIII, I liked the use of complimentary pool and sauna we got to relax quite well The breakfast as well was very varied and well prepared 
Henry VIII, Perfect location for getting around and plenty of places to eat and drink locally Also liked the cold water drinks machine in reception
Henry VIII, The location easy access to central London and nearby tube station 
Henry VIII, The location is good it is though 10 min walk to Paddington The breakfast room is big enough the choice for breakfast is good for couple of days The staff is friendly and helpful The twin room is small but clean the same applies to bathroom Good for a couple of days if you spend most of the time sightseeing and enjoying the city 
Henry VIII, Big and spacious room including a Harry Potter style under stairs room and the breakfast was great Location was awesome One could leave the luggage even after check out which meant exploring London an extra day without lugging stuff around 
Henry VIII,No Positive
Henry VIII, The staff was very nice and accommodating reception and breakfast staff These folks have a hard job they have to sell a terrible product Breakfast was good though 
Henry VIII, Nice hotel with a great location just at the edge of Hyde Park very good breakfast and helpfull staff willing to help at any time Swimming pool in reasonable size with quite small changing room is open till 11 p m 
Henry VIII, The staff was friendly but four stars I m not sure it gets two 
Henry VIII, Breakfast OK nothing special
Henry VIII, Close to two tube stations and Hyde park 
Henry VIII, Nice breakfast
Henry VIII, The desk was staffed continuously and the desk staff were generally helpful and attentive The room was basic but comfortable and housekeeping generally paid good attention to detail 
Henry VIII, Breakfast was very nice with good variety to choose from Staff very friendly and professional Nice pool area and sauna
Henry VIII,No Positive
Henry VIII, Staff where friendly Location was great 
Henry VIII, Great location near Hyde Park and other attractions Plenty of dining options nearby 
Henry VIII, The location and the friendliness of the Staff who all seemed to be Spanish 
Henry VIII, Staff friendly
Henry VIII, Location worked Price was OKish Wouldnt have wanted to pay anymore Staff at check in was nice Staff at check out not bothered 
Henry VIII, Good selection for breakfast Good pool Easy walking distance to tube station
Henry VIII, Location location location But that all depends on what one is looking for This hotel is within walking distance from Paddington and close to one of the stops before that on the Circle Line the beltway line The hotel seems to cater to people from the Iberian peninsula so the hotel staff is very friendly 
Henry VIII, The location was excellent for visiting museums and tourist attractions in central London Very close to Queensway Underground station 
Henry VIII, Very clean Quiet location I asked for a quiet room and that s what I got 
Henry VIII,No Positive
Henry VIII, Location perfect Staff courteous and professional 
Henry VIII, Loved the efficient yet laid back manor of the hotel loved how easy it was to access the pool and although the pool was a little dated I loved it The room was comfy and a fair size The location was great
Henry VIII, Great professional staff Hotel was very clean and had many extras that made the stay very pleasant Good location with shopping and train stations very close I would definitely stay at this hotel again 
Henry VIII, nice breakfast
Henry VIII, The hotel is in a great location I was given a very nice spacious twin room the staff were all very friendly helpful breakfast was plentiful and offered good choice and late check out was very helpful
Henry VIII, The location is brilliant and the staff friendly
Henry VIII, Great to have the pool and the sauna Great location friendly staff 
Henry VIII, Location was very good Staff extremely friendly and helpful Plenty of sights transportation and restaurants within walking distance Great breakfast 
Henry VIII, Excellent choice for breakfast nice eating area with tablecloths Small but clean room Good hotel for location if you just wanted somewhere to sleep 
Henry VIII, Staff and hotel facilities very good Location was spot on just a brisk 10min walk to the nearest tube station Breakfast wasn t over priced and the selection was fine as long you get in early 
Henry VIII, Good location
Henry VIII, Be careful booking this property It is a 2 star The hotels location is where it says it is in London You can sit on the toilet and wash your hands at the same time You can see the TV really well from the bed 
Henry VIII, The bed and bedding were very very basic the safe one of the lights and air conditioning did not work in room One half of dining room was too cold with air conditioning and the breakfast was cheep and cheerful food The bathroom was tiny 
Henry VIII, The breakfast was good
Henry VIII, The breakfast was good with a reasonable selection of cooked or continental breakfast The staff were very friendly and helpful 
Henry VIII, Great location helpful staff breakfast was very good 
Henry VIII, Friendly Staff Great Location for transport links good breakfast easy check in and out 
Henry VIII, The location very good reception very helpfull waiting on staff very good
Henry VIII, Location
Henry VIII, The r ception staff were very friendly and helpful The location was fab walking distance to a lot of things Has a good local pub and a fab Greek restaurant just up the street Great breakfast Hotel looks lovely from outside 
Henry VIII, Location breakfast variety
Henry VIII, Well this hotel is supposed to be a4 star so that s why I booked it it s never seen a 4 star 2 star at a push it s very dated and the didn t have ac so the room was like s sauna there was no end of people complaining about this the rooms are very small also I new it wasn t going to be great because of the price but it states 4 stars I think this needs looking at asap
Henry VIII, The staff were helpful and friendly and the hotel is in a good location 
Henry VIII, Friendly staff Good location Pool was good if a little warm
Henry VIII, Fan in room as air con wasn t working Nice swimming pool good breakfast friendly receptionist
Henry VIII, The breakfast wasn t bad
Henry VIII, Breakfast was good good range Lovely to have a hotel with a swimming pool in London Good location near to Hyde Park and tubes Friendly staff
Henry VIII, 5th floor room was OK this followed our 2 adult stay on a second floor room which was too small Friendly and enthusiastic reception personnel
Henry VIII, Friendly staff and comfortable accommodation 
Henry VIII, Breakfast is somewhat OK The reception staff very helpful and enthusiastic 
Henry VIII, The location was great for tube station a deal for sight seeing Breakfast was lovely plenty choice Had a balcony in our room with a lovely view 
Henry VIII, Easy location near bustling Queensway option of two tube stations 3 lines and close to Hyde Park Got upgraded from double yo triple room so plenty space Tea and coffee in room always welcome Good shower plenty towels and gels etc Finally a place with common sense French doors opened for fresh air but also some air conditioning ceiling fan AND a desk fan Decent choice for breakfast And a small swimming pool Issue with remote control resolved on asking 
Henry VIII, Location for my trip was good
Henry VIII, Very clean and staff very helpful ample choice at breakfast my family loved the breakfast
Henry VIII, Great location and friendly staff
Henry VIII, Great location friendly reception staff Our 2nd stay and would stay again 
Henry VIII, Location near tube Bed was ok Had a tv Bathroom ok 
Henry VIII, it s within a walking distance to central London locations 
Henry VIII, Nice location short walk to Kensington Park and bus stops and only a couple extra blocks to an underground station 
Henry VIII, Good location for transport into central London with Paddington tube station just a short walk away Pool and sauna are a modest size but open late and added to my stay 
Henry VIII, I chose the hotel due to the location in the end it was the only good thing 
Henry VIII, Only the location It was close to hyde park amd 5 minutes walk from the queensway station central line 
Henry VIII, location and the breakfast
Henry VIII, Tiny room but comfortable double bed Clean room served its purpose for 5 days Good breakfast Air con in the room No mini bar but daily room service 
Henry VIII, Location very good staff quite helpful overall pretty clean no dust liked the fact I could open the window lots of places keep the windows locked BUT I needed to open it due to the air con not working 
Henry VIII, The Henry VIII is really well located close to Queensway tube station and only a 15 minute walk from Paddington It s right beside Kensington Gardens and a short but pleaseant walk takes you right to the sights The buffet breakfast is simple but tasty and the cleanliness levels and staff are really good 
Henry VIII, nice and basic not a 4 star hotel a bit old hotel from the inside staff were trying their best cahnged my room after i asked them cause it was too small and the neighbours noisy breakfast basic 
Henry VIII, Pool was divine Hotel is dated but kept very clean Lovely staff apart from the lazy fat waitress
Henry VIII, location is great
Henry VIII, The reception team were friendly and efficient 
Henry VIII, Good location good price nice staff
Henry VIII, Apart from scrambled eggs rubbery and chewy breakfast was good Dining room staff were very friendly 
Henry VIII, The only thing good is location less than 10 min walk to subway car park
Henry VIII,No Positive
Henry VIII, Good reception and welcome
Henry VIII,No Positive
Henry VIII, The beds were large and really comfortable we loved having a bath in our bathroom and the location was really central Fan in the room was great for hot London nights 
Henry VIII, Bathroom was nice 
Henry VIII, Breakfast was good 
Henry VIII, Quiet location clean bathroom and towels and sheets good breakfast
Henry VIII, The location is great 5 minutes walk to the next tube station of central line A 24h shop a pub and two restaurants just a second away Fast WiFi connection in all the hotel 
Henry VIII, Great location the staff are really friendly and the pool and sauna was a good facility to use
Henry VIII, Location was great 
Henry VIII, not much to like really location ok but other hotels in bayswater have better locations
Henry VIII, Close 10 mins walk to Paddington station Good Greek restaurant close by Halepi Small pool was good on the humid day I was in London Tea coffee provided Breakfast was pretty good
Henry VIII, Good location not on a busy road
Henry VIII, Nice pool good sauna
